{
  "name": "Amazon DSP",
  "description": "Amazon's Delivery Service Partner program as an ontology - the cleanest public example of a business-in-a-box: the franchisor supplies brand, demand, playbook and coach; the operator supplies leadership and a team, and grows by hiring drivers rather than driving more. Encodes the whole deal honestly: ~$10K startup, $1M-$4.5M revenue potential, the 40-van ceiling, weekly scorecards, and who keeps the customer relationship.",
  "icon": "🚐",
  "category": "general",
  "tags": ["logistics", "franchise", "business-model", "last-mile", "entrepreneurship"],
  "author": "daocoding"
}
