{
  "name": "Sales Analytics That Speaks Business—Using Fabric IQ Ontology",
  "description": "A Fabric IQ–powered sales ontology that transforms transactional sales data into meaningful business relationships, enabling users to explore concepts like Customers, Orders, Invoices, Returns, Revenue, Products, and Sales Performance using natural business language instead of SQL queries.",
  "icon": "🏭",
  "category": "retail",
  "tags": [
    "industrial automation",
    "electronics manufacturing",
    "factory automation",
    "sales analytics",
    "business intelligence",
    "fabric iq",
    "ontology",
    "semantic modeling",
    "data modeling",
    "business ontology",
    "customer analytics",
    "order management",
    "invoice tracking",
    "returns analysis",
    "revenue insights",
    "sales performance",
    "product analytics",
    "industrial electronics",
    "automation systems",
    "manufacturing intelligence",
    "enterprise analytics",
    "semantic layer",
    "kpi tracking",
    "business semantics",
    "operational insights"
  ],
  "author": "Intech Systems"
}