{
  "name": "Learning Ontology",
  "description": "Canonical learning ontology derived from the reference model in clean_with_keys_and_attributes.owl. It defines business entities, explicit key attributes, required non-key attributes, and core relationships for an HR/learning domain.",
  "icon": "🎓",
  "category": "education",
  "tags": ["learning", "hr"],
  "author": "Mudassar A"
}
